ID_ARTICULO,NOMBRE_ARTICULO
1,Asperiores distinctio eaque ut.
2,Sunt fuga culpa rerum.
3,Nostrum voluptates omnis ab repellendus.
4,Ut aut soluta eaque suscipit.
5,Culpa eligendi distinctio exercitationem porro sequi magnam.
6,Temporibus sapiente at incidunt eius.
7,Ex consectetur voluptatem.
8,Qui mollitia incidunt ab.
9,Velit porro corrupti alias.
10,Nesciunt corporis consectetur est tempore recusandae.
11,Tempore distinctio dolorum.
12,Explicabo nam soluta voluptate.
13,Unde dolores cum reiciendis.
14,Sunt ad qui ex.
15,Rem sint repellat eaque ratione autem.
16,Similique dolore repellendus.
17,Expedita reprehenderit sit dolore optio id eius.
18,Vitae eius odit id.
19,Ex adipisci soluta ea neque voluptates alias.
20,Ipsa quas et non maiores harum nemo ducimus.
21,A unde modi quaerat quia perferendis.
22,Inventore veniam ullam numquam optio commodi.
23,Magni pariatur eveniet possimus mollitia.
24,In velit perspiciatis temporibus nulla.
25,Illo rerum esse distinctio ratione.
26,Omnis iure ipsam distinctio labore temporibus recusandae cumque.
27,Eligendi optio nulla at.
28,Perferendis dolore dicta ad doloribus.
29,Nostrum quisquam iste suscipit nemo quaerat fugit.
30,Doloribus omnis ab quibusdam quo autem.
31,Dolor rem possimus iure nam totam.
32,Itaque reiciendis pariatur voluptates.
33,Et quidem ipsam repellendus tempora incidunt tenetur ipsum.
34,Quia labore ea doloribus.
35,Quisquam maxime occaecati earum aspernatur.
36,Doloremque excepturi tempora aspernatur corrupti.
37,Possimus provident aperiam illum molestiae impedit.
38,Rerum harum quo veniam accusantium.
39,Fugit ab explicabo quidem sequi veritatis in.
40,Reiciendis tempore laborum earum laborum harum pariatur.
41,Quam saepe ullam voluptatem modi tenetur.
42,Natus ad odit consequatur iure amet fugiat distinctio.
43,Excepturi sunt eius veritatis in rerum.
44,Accusantium molestiae voluptatum expedita officiis quos officiis.
45,Veniam dicta accusantium.
46,Dolores labore beatae veniam.
47,Praesentium quisquam cumque non quibusdam beatae reprehenderit.
48,Autem ad est perspiciatis vero.
49,Velit dicta nihil rerum doloribus possimus.
50,Sed nobis commodi voluptates quos.
